,date,Longitude,Latitude,State,tweet_clean,sentiment,sentiment_category,y_predict
2831,2022-11-18,-86.40961,35.84742,TN,even choos save three toddler leav fetus still doesn follow that think fetus aren human aren worth save certainli doe noth suggest that abort moral permiss,0.8074,positive,positive
2832,2022-11-18,-86.2705395,45.00118,MI,hyde ammend from forbid dollar be use abort actual care about realiti,0.2263,positive,positive
2833,2022-11-18,-66.01188,18.3435455,PR,abort issu decid state legislatur feder govern famili matter marriag law tax crime prevent found father wrote constitut prevent establish overreach feder govern tyranni,-0.4939,negative,negative
2834,2022-11-18,-108.4025685,43.03499,WY,written constitut that woman bodi her decid would sign abort object same should govern entiti concern,0.0,neutral,positive
2835,2022-11-18,-120.672634,35.4861605,CA,which refer pray think jesu christ support abort fraud deceit,-0.4215,negative,negative
2836,2022-11-18,-81.8409045,41.1525105,OH,cours gotta ahead that abort ballot initi,0.0,neutral,neutral
2837,2022-11-18,-71.566171,44.00123,NH,congratul they leader need time when protect abort right strengthen public educ address high cost live mind mani granit stater nhpolit,0.5994,positive,positive
2838,2022-11-18,-119.3066075,37.2691755,CA,piti when studi histori theolog cathol posit more understand millennia gentil convert just kill abandon unwant children church tighten abort posit centuri with rise eugen,-0.8225,negative,negative
2839,2022-11-19,-74.066663,40.7180015,NJ,like they could abort though,0.3612,positive,positive
2840,2022-11-19,-87.896835,42.8832745,WI,,0.0,neutral,neutral
2841,2022-11-19,-80.134986,26.3739755,FL,still abort reverend,0.0,neutral,neutral
2842,2022-11-19,-77.604684,41.1179365,PA,abort women right sure absolut right argu be abl have consensu relationship human compar appl appl make your point,0.3182,positive,positive
2843,2022-11-19,-77.2369685,38.8051145,MD,bonu abort,0.0,neutral,neutral
2844,2022-11-19,-86.8511765,35.935017,TN,final mine murder legal terminolog abort illeg everywher cannot murder howev bear fals wit call someon murder meddl like murder thief evildo peter repent obsess idolatri,-0.9726,negative,negative
2845,2022-11-19,-92.131274,34.7519365,AR,exampl mindset consid abort birth control five singl wade make them hesit have nearli four five claim they chang their date behavior sinc suprem court rule arpx,0.0,neutral,neutral
2846,2022-11-19,-90.247824,38.653771,MO,american birth rate have drop last gener simpli becaus abort femnazi ideolog,-0.2732,negative,negative
2847,2022-11-19,-86.8511765,35.935017,TN,soul never lost result abort soul lost failur believ upon truth even make uncomfort meddl like murder thief evildo must renounc peter obsess with girl uterus idolatri exodu,-0.5229,negative,negative
2848,2022-11-19,-119.3066075,37.2691755,CA,come check world biggest collect right wing meme polit humor joebiden donaldtrump rondesanti tedcruz maga nancypelosi inflat tax gaspric ukrain abort gun,-0.0772,negative,negative
2849,2022-11-19,-77.6543395,39.9340275,PA,abort right healthcar murder veri evil abort democrat abort industri justifi just polit issu ultim human right issu need thi holocaust everi,-0.8779,negative,negative
2850,2022-11-19,-95.619479,30.1013615,TX,graham what doesn contain phrase woman never mention abort never mention marijuana never mention word patriot doesn mention homosexu asid from vers that danc around topic usual refer pedophilia instead,0.0,neutral,neutral
2851,2022-11-19,-97.754724,30.3233455,TX,abort murder,-0.6908,negative,negative
2852,2022-11-19,-78.8954405,35.9909825,NC,former anti abort leader alleg anoth suprem court breach,-0.3182,negative,negative
2853,2022-11-19,-96.7311425,43.5410145,SD,just bought sweatshirt support rage against abort ban,-0.6705,negative,negative
2854,2022-11-19,-122.630908,45.536402,OR,late abort,0.0,neutral,neutral
2855,2022-11-19,-79.420865,38.0033755,VA,favor myself kerr onancock said wert steal els word like collus abort parlanc vernacular told truth leav money alon norri that came your name capit get front kid quot,0.5106,positive,positive
2856,2022-11-19,-96.7617535,32.8198585,TX,anyon research darkmoney end democraci dedic decad alreadi knew stori feet know there access influenc stack conserv yell emphasi nada,0.0,neutral,neutral
2857,2022-11-19,-82.985772,39.9946835,OH,abort,0.0,neutral,neutral
2858,2022-11-19,-79.861034,35.1704985,NC,better plan feder marriag feder abort these thing enumer constitut therefor they belong variou state,0.4404,positive,positive
2859,2022-11-19,-96.7617535,32.8198585,TX,reread conserv justic ginnithoma alito swife nino,0.0,neutral,neutral
2860,2022-11-19,-79.467812,36.078021,NC,tell lie republican state want abort everi bodi they didn care that year gotten pregnant result rape they still expect child keep babi,-0.296,negative,negative
2861,2022-11-19,-77.604684,41.1179365,PA,want illeg have abort which,0.0772,positive,positive
2862,2022-11-19,-96.7617535,32.8198585,TX,,0.0,neutral,neutral
2863,2022-11-19,-96.7617535,32.8198585,TX,when framer constitut own peopl slave women children were chattel centuri later struggl freedom equal goe use could forc abort woman decid herself still,0.6369,positive,positive
2864,2022-11-19,-75.815956,39.968025,PA,obviou fake onli beneficiari wade leak were extremist suprem court member with leak alito wrap seal kill wade,-0.9118,negative,negative
2865,2022-11-19,-86.6807375,32.576227,AL,kill person onli earlier stage develop pregnanc onli roughli anyth other than live birth miscarriag stillbirth death mother time abort perform end life earli,-0.8625,negative,negative
2866,2022-11-19,-80.293053,26.683693,FL,interest realli there should child support requir state which allow abort sinc motherhood voluntari after pregnaci should fatherhood well roevwad paid tummytenantlaw,0.8271,positive,positive
2867,2022-11-19,-86.243063,41.7008805,IN,interview here best account defens convinc would worri about privat dinner with peopl with strong view veri gener matter,0.8225,positive,positive
2868,2022-11-19,-86.243063,41.7008805,IN,basic abort activist interview subject were famous embarrass moral they plausibl disqualifi would have dinner with likemind friend constant process cynic lose parti unhealthi view,-0.4767,negative,negative
2869,2022-11-19,-118.03082,34.133783,CA,amen lucif whisper have right trust major celebr high govern offici religi leader they support your right what want free just think about rememb abort legal forget,0.8481,positive,positive
2870,2022-11-19,-76.955799,38.9608415,MD,,0.0,neutral,neutral
2871,2022-11-19,-122.3001295,47.827984,WA,perhap most import investig analysi will read thi year link,0.0,neutral,neutral
2872,2022-11-19,-122.296281,47.1192855,WA,kruss brittney have great abort violenc,0.6249,positive,positive
2873,2022-11-19,-77.0908695,38.81738,VA,fachner after articl thi morn former anti abort leader alleg anoth suprem court breach that even option,-0.3182,negative,negative
2874,2022-11-19,-122.296281,47.1192855,WA,kruss brittney mani privileg right make world uneasi live abort violenc,0.0,neutral,neutral
2875,2022-11-19,-122.296281,47.1192855,WA,kruss brittney focu caus abort prevent someon get pregnant know that will abort what kind societi rais,0.5423,positive,positive
2876,2022-11-19,-81.8030515,41.4804175,OH,quick remind christian friend here complet list everyth jesu said about abort gay,0.4939,positive,neutral
2877,2022-11-19,-122.296281,47.1192855,WA,kruss brittney your bodi your choic when someon die develop complic dure abort whom blame peopl start su doctor govern stop first place make someon ladi accept prevent cost plan your futur,-0.7003,negative,negative
2878,2022-11-19,-83.139281,40.1252735,OH,cours ohio super major focus instead restrict vote lbgtq right abort right censor classroom book grab more power decad declin fascism,-0.1779,negative,negative
2879,2022-11-19,-89.922029,35.1335205,TN,schenck shift view abort recent year alien from mani former associ tri establish himself progress evangel leader cours grifter gotta grift,0.4215,positive,positive
2880,2022-11-19,-86.2705395,45.00118,MI,mean post term abort,0.0,neutral,neutral
2881,2022-11-19,-122.296281,47.1192855,WA,kruss brittney right privaci name abort when someon die dure process whom blame ask simpl question abort peopl should respons make decis that harm other societi gener,-0.8689,negative,negative
2882,2022-11-19,-122.296281,47.1192855,WA,kruss brittney need address idea abort entireti question abort could have prevent what avoid abnorm becom normal,-0.2732,negative,negative
2883,2022-11-19,-85.7682405,37.822244,KY,better place state with democrat governor abort access,0.4404,positive,positive
2884,2022-11-19,-122.296281,47.1192855,WA,kruss brittney self made opinion which ration accept reject side stori justifi mean hear both side have mani abort america unprotect sexual behavior,-0.0258,negative,negative
2885,2022-11-19,-73.9487755,40.655138,NY,said right after overturn leak thi leak came from conserv forc hand anyon possibl waver fenc thi onli confirm those suspicion,-0.4939,negative,negative
2886,2022-11-19,-82.3882145,36.3447405,TN,worth note that peopl call biden refus communion becaus stanc abort veri quiet about cathol justic support death penalti direct violat cathol teach,-0.0772,negative,negative
2887,2022-11-19,-73.0057655,40.879379,NY,dure thi trump elect human right more stake than ever women lose access abort blacc peopl be incarcer extrajudici execut more than ever neonazi terorist storm damn capitol good bleck twitter,-0.3612,negative,negative
2888,2022-11-19,-122.296281,47.1192855,WA,kruss brittney neither have mssd point priest doctor they oper they oper under rule establish major player everyth they support abort peopl should grow have good decis engag,0.6808,positive,positive
2889,2022-11-19,-79.9806895,40.431389,PA,have much nostalgia warren court forget conservat white supremaci bake into scotu from dred scott plessi also hobbi lobbi loot artifact build histor incorrect museum will shop michael forev,-0.2263,negative,negative
2890,2022-11-19,-105.1233195,39.685852,CO,,0.0,neutral,neutral
2891,2022-11-19,-97.754724,30.3233455,TX,,0.0,neutral,neutral
2892,2022-11-19,-75.599807,38.731723,DE,republican paid price overturn have been worth,0.2263,positive,neutral
2893,2022-11-19,-71.463968,41.768938,RI,check thi articl from becaus subscrib read through thi gift link without subscript,0.4404,positive,positive
2894,2022-11-19,-79.420865,38.0033755,VA,ban parenthood claim that case homicid just postpartum abort constitut right,-0.5574,negative,negative
2895,2022-11-19,-85.510207,36.1395275,TN,word mine pretti dopey right,0.0,neutral,neutral
2896,2022-11-19,-86.243063,41.7008805,IN,agre with that think like imposs when come pictur case like abort free exercis would have object kagan pall around with liber professor head aclu what think these step would,0.8074,positive,positive
2897,2022-11-19,-95.913642,36.1093915,OK,evangel screech that trump use them they use they knew about rape ivana sexual assault affair they overlook thi they want abort badli play victim,-0.836,negative,negative
2898,2022-11-19,-122.3306025,47.614817,WA,major exactli what think abort clinic clinic liter titl dumb,-0.5106,negative,neutral
2899,2022-11-19,-95.913642,36.1093915,OK,evangel screech that trump use them they use they knew about rape ivana sexual assault alleg pussi grab affair they overlook thi they want abort badli play victim,-0.836,negative,negative
2900,2022-11-19,-122.3306025,47.614817,WA,grave betray trust somebodi samuel alito week,-0.5423,negative,neutral
2901,2022-11-19,-92.4367735,38.3045585,MS,that lost missouri radar educ want start with test score get bottom school rank,-0.25,negative,negative
2902,2022-11-19,-82.3882145,36.3447405,TN,want clear about someth comment said livestream about biden codifi democrat care about women thi misrepresent slim margin rule hous senat vote aren there,0.7269,positive,positive
2903,2022-11-19,-118.4119065,34.0207895,CA,schenck view abort contracept have evolv belatedli might argu motiv smear alito were lie about thi wouldn have releas thi inform time dobb rule when politico leak emerg befor that,-0.5994,negative,negative
2904,2022-11-19,-81.828667,38.378872,WV,alito onli show seriou favorit court also want brag about former anti abort leader alleg anoth suprem court breach,-0.25,negative,negative
2905,2022-11-19,-86.2705395,45.00118,MI,founder challeng american corpor provid pregnant peopl rather than offer their babi kill abort,-0.6908,negative,negative
2906,2022-11-19,-117.7823605,33.689732,CA,report thi articl accur justic alito hopelessli corrupt court lurch right must correct court been pack with federalist cultist hobbi lobbi decis extrem danger preced,-0.5267,negative,neutral
2907,2022-11-19,-74.184848,40.734494,NJ,cathol bishop worri about abort view pewsu cathol bishop worri about abort view pew,0.0,neutral,neutral
2908,2022-11-19,-118.4119065,34.0207895,CA,former anti abort leader alleg learn hobbi lobbi contracept rule week befor suprem court releas alito wrote major opinion implic leaker wonder leak anoth rule know,-0.5719,negative,negative
2909,2022-11-19,-77.2038845,38.9374855,VA,surpris magascotu former anti abort leader alleg anoth suprem court breach,-0.3182,negative,negative
2910,2022-11-19,-77.0143985,38.898603,DC,ladi gentlemen,0.0,neutral,neutral
2911,2022-11-19,-79.95791,37.2744885,VA,anybodi surpris never about life alway about control women live actual about their be anti gener they realli care simpli about abort they first make birth control wide access,0.2263,positive,positive
2912,2022-11-19,-118.129042,33.8880815,CA,four life advoc sentenc jail tri save babi from abort,0.4939,positive,positive
2913,2022-11-19,-121.979527,37.5236445,CA,simpl abort live some fantasi world where there jail aren one cri thi shred human left wouldn order spare from miseri suffer bargain chip,-0.4019,negative,negative
2914,2022-11-19,-95.5398525,30.1812515,TX,sorri went through that these anti abort law should includ claus that requir guy support women children with heavi penalti those know that gonna happen,0.1027,positive,positive
2915,2022-11-19,-80.926628,33.6311395,SC,there ever case abort right thi,0.0,neutral,neutral
2916,2022-11-19,-86.2705395,45.00118,MI,author corpor must stop incentiv pregnant peopl live their children simpli becaus help their bottom line peopl matter more than profit labor right preborn right,0.5829,positive,positive
2917,2022-11-19,-80.6909725,35.0922805,NC,that they singl when with someon have accept that they free thinker abort even though person wouldn kill babi base moral believ everyon free have choic whatev they want,0.5859,positive,positive
2918,2022-11-19,-81.3677725,28.5016785,FL,thi nationaladoptionday love adopt year birth unwav never end birth parent pleas choos adopt over abort christian attend high school,0.765,positive,positive
2919,2022-11-19,-96.961483,32.863917,TX,abort simpli murder innoc,-0.6908,negative,negative
2920,2022-11-19,-72.160536,43.355063,NH,wonder black abort state affect peopl mani stori about,0.0,neutral,neutral
2921,2022-11-19,-85.510207,36.1395275,TN,alito leak dobb decis becaus done that befor,-0.34,negative,negative
2922,2022-11-19,-75.117998,40.0048655,PA,beg take rare step run thi stori sunday york time work headlin reflect explos natur complet stori pleas former anti abort leader alleg anoth suprem court breach,-0.3182,negative,negative
2923,2022-11-19,-75.117998,40.0048655,PA,read whole stori headlin least import aspect what stori reveal dropper instant pulitz finalist incred report pleas read former anti abort leader alleg anoth suprem court breach,-0.3182,negative,negative
2924,2022-11-19,-75.117998,40.0048655,PA,just rememb abort after,0.0,neutral,neutral
2925,2022-11-19,-87.732013,41.8335845,IL,wait joke about paul pelosi skull be crack republican with hammer about some back alley abort joke guy such bunch,0.5267,positive,positive
2926,2022-11-19,-119.3066075,37.2691755,CA,come check your favorit meme hunt ground donaldtrump maga trump desanti joebiden letsgobrandon vaxmand abort tax meme funni,0.0,neutral,neutral
2927,2022-11-19,-82.3314755,34.9389675,SC,push adulter abort initi over warnock tell again about be parti christian famili valu,0.0,neutral,negative
2928,2022-11-19,-76.7466385,38.9637825,MD,conserv group sue revok approv abort pill,0.0,neutral,neutral
2929,2022-11-19,-100.0768885,31.1688935,TX,texa abort ever,0.0,neutral,neutral
2930,2022-11-19,-77.0143985,38.898603,DC,bombshel about republican evangel success campaign infiltr suprem court secur leak from alito make alito meet with anti activist brian brown even more interest kavanaugh also attend,0.5095,positive,negative
2931,2022-11-19,-72.699082,40.819078,NY,befor power must impeach inquiri complet vote upon hous into justic alito thoma impeachalito impeachthoma former anti abort leader alleg anoth suprem court breach,-0.3182,negative,negative
2932,2022-11-19,-75.117998,40.0048655,PA,former anti abort leader alleg anoth suprem court breach,-0.3182,negative,negative
2933,2022-11-19,-90.5883815,38.5881625,MO,black woman cowork gestat diabet high risk have babi thi countri should have afford healthcar,-0.2732,negative,negative
2934,2022-11-19,-91.0907995,30.4591,LA,race they taken step toward ban abort believ pope particular view feder,-0.5574,negative,negative
2935,2022-11-19,-77.1631025,39.087055,MD,obvious abort sodomi wrong what say automat send hell what plu side obey think bless,-0.7096,negative,negative
2936,2022-11-19,-73.9685415,40.780709,NY,schenck evangel nonprofit learn about hobbi lobbi opinion becaus work year exploit court permeabl gain access thru faith favor trade with gatekeep wealthi donor abort oppon call stealth missionari,0.802,positive,positive
2937,2022-11-19,-105.064586,39.581987,CO,world where tell christiannationalist will polit their respons would decid whether will polit former anti abort leader alleg anoth suprem court breach,-0.3182,negative,negative
2938,2022-11-19,-83.6540795,32.8488175,GA,earli sourc from insid suprem court have leak inform anti choic other right evangel group theori been that sourc april leaker dobb decis conserv look gloat,-0.5719,negative,negative
2939,2022-11-19,-79.815866,37.8222815,VA,when power rich organ individu have influenc over branch govern suggest thi articl democraci,0.5574,positive,positive
2940,2022-11-19,-91.0907995,30.4591,LA,they didn abort nation,0.0,neutral,neutral
2941,2022-11-19,-106.662024,35.296183,NM,yeah realli equal justic under thi articl bombshel outlin level fraud corrupt white christian nation evangel will corrupt scotu justic will influenc scotu,-0.3818,negative,negative
2942,2022-11-19,-86.8511765,35.935017,TN,soul never lost result abort soul lost failur believ upon truth even make uncomfort meddl like murder thief evildo must renounc peter obsess with girl uterus idolatri exodu,-0.5229,negative,negative
2943,2022-11-19,-83.1738665,32.6782075,GA,,0.0,neutral,neutral
2944,2022-11-19,-100.0768885,31.1688935,TX,harass twelv year would leav alon father push away from reason thi problem outsid abort clinic they were protest,-0.7845,negative,negative
2945,2022-11-19,-81.3677725,28.5016785,FL,anti abort extremist will stop noth their cruel agenda control freedom,-0.4767,negative,negative
2946,2022-11-19,-74.113499,40.9814505,NJ,scotu cesspool corrupt especi conserv robert tool thoma should impeach tri sedit alito disgrac himself court kavanaugh gorsuch barrett told impeach lie court,0.0,neutral,neutral
2947,2022-11-19,-100.0768885,31.1688935,TX,tiktok make dumbest abort argument ever,-0.7003,negative,negative
2948,2022-11-19,-77.101999,38.8808445,VA,year befor leak draft opinion overturn wade landmark contracept rule disclos accord minist secret effort influenc justic former anti abort leader alleg anoth suprem court breach,-0.5267,negative,negative
2949,2022-11-19,-74.946407,40.102243,PA,former anti abort leader alleg anoth suprem court breach,-0.3182,negative,negative
2950,2022-11-19,-77.1631025,39.087055,MD,like abort realli sodomi god love unchang other than have lighter soul receiv your bless what incent godli,0.891,positive,positive
2951,2022-11-19,-80.9093545,28.968526,FL,against capit fair right been vote abort judg while right wing politician judg that will allow briberi onli legal even know give them money know own them,0.5719,positive,positive
2952,2022-11-19,-80.1129035,26.533486,FL,name will state vote publicli will allow abort,0.2263,positive,positive
2953,2022-11-19,-83.269058,42.6646845,MI,abort stop beat heart that murder,-0.7845,negative,negative
2954,2022-11-19,-73.32469,40.762128,NY,well abort mayb keep those babi make sens peopl keep vote back into offic,0.2732,positive,neutral
2955,2022-11-19,-73.9685415,40.780709,NY,have watch more promis girl from that town pregnant teenag lose their life plan potenti becaus mandat medic accur comprehens posit lgbtqia affirm educ equal easi access birth control abort,-0.4019,negative,negative
2956,2022-11-19,-83.1738665,32.6782075,GA,go chang mind care absent father woman beater abort lover spare thi rhetor,0.7906,positive,positive
2957,2022-11-19,-70.614284,41.680607,MA,they better with program they were humili thi elect part abort women will they respons,0.4404,positive,positive
2958,2022-11-19,-76.627516,39.4939495,MD,jordan there such thing life women across thi countri that suffer right especi those that have condit where they need have abort woman almost lost life never carri kid would have procedur,-0.6712,negative,negative
2959,2022-11-19,-76.627516,39.4939495,MD,decid have abort court forc keep enough mother enough vote come with law rule everi time someth doesn work your fuck,-0.5423,negative,negative
2960,2022-11-19,-76.627516,39.4939495,MD,year old enough assault rifl that mass destruct automat rifl with round clip that okay though right okay forc year girl have after be rape decid have abort,-0.8779,negative,negative
2961,2022-11-19,-117.649072,33.5066425,CA,reproduct care what about abort reproduct,0.4939,positive,positive
2962,2022-11-19,-158.0114715,21.446277,HI,bishop mani address abort when will other address adopt,0.1779,positive,positive
2963,2022-11-19,-85.7682405,37.822244,KY,talk about abort amongst other subject,0.0,neutral,neutral
2964,2022-11-19,-85.6945125,38.440843,IN,both biden claim cathol cannot believ lord jesu christ also support mass extermin unborn there more be fill denomin than say support abort show what realli,0.6597,positive,positive
2965,2022-11-19,-83.0688615,34.7717485,SC,master rare over life democrat their elect bid thi year,0.0,neutral,neutral
2966,2022-11-19,-74.4411045,40.488195,NJ,abort control bodi govern busi should drink drug prostitut law invalid be invas person choic over cours,0.0,neutral,neutral
2967,2022-11-19,-84.5634145,33.811316,GA,kati hobb want legislatur repeal state centuri abort republican go control both chamber just vote each,0.0772,positive,positive
2968,2022-11-19,-98.716992,35.3090465,OK,easi be choic when be dismemb prochoic abort,0.0,neutral,neutral
2969,2022-11-19,-98.716992,35.3090465,OK,babi then pregnant what abort abort,0.0,neutral,neutral
2970,2022-11-19,-115.223125,36.232915,NV,know women use abort babi befor they abort clinic would rather woman tri abort have babi after babi born then what ton more welfar watch these lifer complain about overwhelm,-0.4939,negative,negative
2971,2022-11-19,-100.0768885,31.1688935,TX,fundrais abort fund with decemb abortionishealthcar,0.0,neutral,neutral
2972,2022-11-19,-79.179013,37.4009555,VA,well david stand firm thi exactli would stand firm abort argu natur other repres common good other where exactli line these peopl,0.6124,positive,positive
2973,2022-11-19,-86.611411,34.7060265,AL,think everyth aw that happen thi nation been fault democrat slaveri crow segreg resist women vote war abort crime etcetera wors parti than them,-0.8779,negative,negative
2974,2022-11-19,-92.0263525,34.9826985,AR,agist mean realli these one speak peopl thi gener which such abort represent even arkansa stand show them aren these honkey fool stereotyp with blue,-0.4404,negative,negative
2975,2022-11-19,-118.0071635,33.900901,CA,champ enjoy rest thi abort season,0.743,positive,positive
2976,2022-11-19,-82.985772,39.9946835,OH,democrat ethic conscienc they want abort after birth allow illeg flood into countri republican preserv life protect border,0.5859,positive,positive
2977,2022-11-19,-71.0887125,42.3136695,MA,what mostli amaz that everyon concern about thi case howev abort good bonker,0.4404,positive,positive
2978,2022-11-19,-110.9155735,32.1893905,AZ,,0.0,neutral,neutral
2979,2022-11-19,-75.770041,42.746617,NY,know what super follow super follow wasn given choic stop go when they start use their religion exclud birth control abort care employe insur plan chick pillow ever,0.8689,positive,positive
2980,2022-11-19,-96.2916485,30.5854715,TX,even like abort should woman bloodi govern,0.3612,positive,positive
2981,2022-11-19,-115.223125,36.232915,NV,some these politician these decent were one push abort their younger mistress they thought would hurt their career that herschel perfect exampl decent hypocrit,0.0772,positive,positive
2982,2022-11-19,-115.223125,36.232915,NV,abort have been happen sinc ancient egypt they will alway happen onli differ will they will safe babi will fulli abort will born with sever damag girl will from botch abort that clinic were made,0.4404,positive,positive
2983,2022-11-19,-73.053745,41.224028,CT,omara talk pollster didn construct poll take into account just voter question about health care abort elect denier,0.1779,positive,positive
2984,2022-11-19,-115.223125,36.232915,NV,know would have exactli what they normal sure where woman abort need past unless mother danger unless pregnant child they have valid medic reason,-0.2732,negative,negative
