,date,Longitude,Latitude,State,tweet_clean,sentiment,sentiment_category,y_predict
4230,2022-11-29,-74.8081255,40.271043,NJ,thi dude went high school with post screenshot forc woman abort call when block delet whole busta,-0.4404,negative,negative
4231,2022-11-29,-121.9415795,37.758225,CA,given abort check,0.0,neutral,neutral
4232,2022-11-29,-79.420865,38.0033755,VA,there still plenti debat among rape counselor psychologist regard benefit abort teenag rape victim sinc act timekeep second find chines mistress pregnant suddenli see util abort,-0.8591,negative,negative
4233,2022-11-29,-74.011779,40.830002,NJ,kinda tire herschel stori they move needl sadli vote regardless they care about abort hypocrisi abus gener unfit resid issu,0.4939,positive,positive
4234,2022-11-29,-83.804475,27.698682,FL,georgian right thing warnock back senat ignor walker falsehood lie spew nonsens proven himself poor excus father pay abort evad child support doesn free charit work they figur,0.3612,positive,negative
4235,2022-11-29,-77.604684,41.1179365,PA,retroact abort republican,0.0,neutral,neutral
4236,2022-11-29,-75.117998,40.0048655,PA,quad public market over under specul make valu then gold silver implement open grant standard project just over abort racism gay start starv bomb peopl with foreign,-0.7003,negative,negative
4237,2022-11-29,-81.983621,29.0075065,FL,coloni open border antifa defund polic high crime inflat abort common good,-0.1531,negative,negative
4238,2022-11-29,-96.2916485,30.5854715,TX,know what woman goe through decid abort tell that sister that couldn termin pregnanc under current abort becaus forc deliv week that wasn go surviv instead die arm,-0.5994,negative,negative
4239,2022-11-29,-76.2427075,39.477453,MD,thi abort,0.0,neutral,neutral
4240,2022-11-29,-105.1281885,39.8202065,CO,hmmm want anyon that doesn agre with have them arrest want take healthcar from women becaus they believ what believ about abort your stupid know bound your hypocrisi stun pleas stfu,-0.6369,negative,negative
4241,2022-11-29,-83.1738665,32.6782075,GA,that warnock abort until moment birth attack democrat twitter want that elect democrat that they want pass with limit abort peopl understand that mean month,-0.3612,negative,negative
4242,2022-11-29,-83.1738665,32.6782075,GA,then they want limit case that everyon want limit they refus support limit that question major american against trimest abort elect democrat,0.5106,positive,positive
4243,2022-11-29,-82.8541995,40.021793,OH,silenc victim just have right forc your religi opinion upon other abort public school prayer,-0.2732,negative,neutral
4244,2022-11-29,-83.1738665,32.6782075,GA,accus anonym woman pay abort vote money abort guess miss warnock been accus abus walker abus part redempt stori warnock doesn acknowledg plu,-0.25,negative,negative
4245,2022-11-29,-100.0768885,31.1688935,TX,petal narvaez again would rather woman morn after pill than wait have abort,0.0,neutral,neutral
4246,2022-11-29,-93.2620465,44.9706105,MN,join decemb scotu rais hell after year dobb oral argument demand abort access women fuck scotu,-0.872,negative,negative
4247,2022-11-29,-74.066663,40.7180015,NJ,abort america that impact when there mani other much import caus world like starv children,0.3612,positive,positive
4248,2022-11-29,-83.1738665,32.6782075,GA,will vote reverend support abort until moment birth slumlord good,0.6808,positive,positive
4249,2022-11-29,-99.6809025,41.5007295,NE,make great case abort,0.6249,positive,positive
4250,2022-11-29,-85.7682405,37.822244,KY,,0.0,neutral,neutral
4251,2022-11-29,-85.7682405,37.822244,KY,stori retain year could abort ohio after overthrow roll versu wade indiana,0.0,neutral,neutral
4252,2022-11-29,-117.1195165,33.501021,CA,should abort illeg invas,0.0,neutral,neutral
4253,2022-11-29,-100.0768885,31.1688935,TX,there some middl ground there some libertarian moder wire issu that lib conserv will never conced ground abort amend someon drink democrat kool wast your time,0.2263,positive,positive
4254,2022-11-29,-78.657837,35.8439815,NC,here creat lifelongvot abort care protect southern forest,0.7003,positive,positive
4255,2022-11-29,-98.5406515,29.417501,TX,dream pregnant frantic tri abort,-0.2263,negative,neutral
4256,2022-11-29,-84.205795,37.9911125,KY,sens choic abort issu unborn babi should have choic whether want live commun decis then should live default,0.0772,positive,positive
4257,2022-11-29,-100.0768885,31.1688935,TX,real shame america liber like your kind were abort their month that been case biggest cheerlead abort today would have been around,0.6705,positive,positive
4258,2022-11-29,-100.0768885,31.1688935,TX,most state have outlaw abort there system place chang state respons manag what taught school democrat would probabl find democrat also kept peopl from vote,0.0,neutral,neutral
4259,2022-11-29,-72.2499855,43.642878,NH,definit solidli mainstream moder reactionari blue abort voter perhap liber oregon vermont veri high social servic spend conserv,0.0,neutral,neutral
4260,2022-11-29,-108.5746165,39.0917505,CO,love mine deni care ectop pregnanc state with abort restrict issu hospit cathol final travel there decid brave consequ gave care need terrifi hard receiv,0.9001,positive,positive
4261,2022-11-29,-91.0898815,30.3673475,LA,qualifi teacher shortag dcf problem get ugli realli fast agre there issu start with unfit parent blame abort access home insur crisi huge your area sure,-0.128,negative,negative
4262,2022-11-29,-115.2344355,36.0188045,NV,attack walker dem root intellig would georgia want someon display below grade intellig plu against abort would vote paid mani life vote ignor kid,-0.4215,negative,negative
4263,2022-11-29,-84.1920685,34.038017,GA,wife head threaten kid with death think elect erect abort count unknown countless lie about background educ defraud veteran with fake chariti nice moron some actual live georgia,-0.875,negative,negative
4264,2022-11-29,-90.322616,38.6107965,MO,,0.0,neutral,neutral
4265,2022-11-29,-77.604684,41.1179365,PA,rememb that ultra christo believ pill equival abort,0.0,neutral,neutral
4266,2022-11-29,-84.266174,30.4762155,FL,wanna thi abort rent guess move with momma,0.0,neutral,neutral
4267,2022-11-29,-85.8709395,37.6989725,KY,liber abort health magazin use small sampl women abort women with their abort that definit propaganda,-0.25,negative,negative
4268,2022-11-29,-86.793917,33.5422375,AL,write republican nation committe convent either problem with georgia situat state thorough regard abort sometim seem entir countri wait georgia decid develop wrong idea,-0.7003,negative,negative
4269,2022-11-30,-73.602047,40.6319905,NY,perhap mayb democrat shouldn extrem abort last minut execut child,0.0,neutral,neutral
4270,2022-11-30,-116.361297,33.7405385,CA,doctor spoke about provid abort year rape victim travel from ohio after more restrict abort took effect,-0.8655,negative,negative
4271,2022-11-30,-92.4367735,38.3045585,MS,they need same with abort,0.0,neutral,neutral
4272,2022-11-30,-112.1246765,33.5528625,AZ,cover ground talk today respectformarriageact abort right contest midterm dem push primari watch goodeveningarizona tonight azfamili,0.0,neutral,neutral
4273,2022-11-30,-71.879604,42.135932,MA,rememb adrienn go abort clinic time when found someth shadi about justin justin show livid think adrienn lost babi anyway day never gave birth onscreen,-0.7003,negative,negative
4274,2022-11-30,-118.4119065,34.0207895,CA,voter across countri approv minimum wage increas protect access abort support cannabi legal approv measur increas hous afford promot good union job progress valu reson with midterm voter,0.8885,positive,positive
4275,2022-11-30,-76.0710845,43.0751145,NY,deep level mayb deep thi about love hate relationship with mostli hate also underli their opposit abort becaus they relat promiscu bottom line they know well they obsess about,-0.4767,negative,negative
4276,2022-11-30,-84.6564475,38.989258,KY,fals compass convinc woman that end life unborn child solv problem exec krtl forgo fals compass abort offer women real love news today,0.3612,positive,positive
4277,2022-11-30,-98.5406515,29.417501,TX,they hate when young peopl move here know ban abort go after univers probabl best,-0.4767,negative,negative
4278,2022-11-30,-95.4464865,29.838495,TX,fact krypronit libtard like yourself have been border have seen abort that southern border charg that border czar,0.3612,positive,positive
4279,2022-11-30,-75.117998,40.0048655,PA,desanti ban abort write book call courag free religi extremist coney barrett write book judg should imparti josh hawley podcast instruct life jesu driven life wish were kid,0.34,positive,positive
4280,2022-11-30,-105.5508905,38.997936,CO,analysi post elect memo inflat abort rank prioriti tech legisl voter radar,0.0,neutral,neutral
4281,2022-11-30,-71.0914005,42.780778,MA,matern morbid fetal outcom among pregnant women week gestat less with complic texa hospit after legisl abort,0.0,neutral,positive
4282,2022-11-30,-122.9006975,38.7024165,CA,gavin scott support rape violenc afflict women have abort after their support assault womensrightsarehumanright,-0.6249,negative,negative
4283,2022-11-30,-104.731181,40.3753095,CO,parti religion anti abort want vote paid abort instead reverend peopl know what support anymor,0.1779,positive,positive
4284,2022-11-30,-74.350498,39.605735,NJ,true question said abort there some kind proof,0.7351,positive,positive
4285,2022-11-30,-84.433106,33.7671945,GA,kid sibl onli fatherless brotherless elimin post born abort parent be readi equip parent some have abort when doe want babi doe know,0.0772,positive,positive
4286,2022-11-30,-73.9685415,40.780709,NY,decid read room work gather hobbi lobbi begin discuss be abort have anim sacrif practition santeria assum will have your support,0.4019,positive,positive
4287,2022-11-30,-71.0887125,42.3136695,MA,like abort good christian that,0.6597,positive,positive
4288,2022-11-30,-73.9685415,40.780709,NY,decid read room work gather hobbi lobbi begin discuss be abort have anim sacrif practition santeria assum will have your support,0.4019,positive,positive
4289,2022-11-30,-100.0768885,31.1688935,TX,could imagin reason ever have have abort neither should govern appoint investig panel thi decis between woman,0.0,neutral,neutral
4290,2022-11-30,-112.034433,43.498923,ID,especi abort hear,0.0,neutral,neutral
4291,2022-11-30,-120.419584,34.932367,CA,knew what meant assert personhood individu with down syndrom becaus mani peopl regard their live be equal digniti worth which there alway pressur govern medic profession have abort,0.2263,positive,neutral
4292,2022-11-30,-83.1738665,32.6782075,GA,parodi thi same legal histori that wrong slaveri abort appeal scriptur know noth interraci marriag same marriag,-0.3818,negative,negative
4293,2022-11-30,-122.4359785,37.7706565,CA,state which have said legal have abort until birth have been veri specif that woman need agreement from doctor that they made illeg becaus peopl were die be forc through traumat experi,-0.0516,negative,negative
4294,2022-11-30,-91.209121,43.8056435,WI,hysterectomi day today year anniversari start testosteron gender affirm care life save just like abort decis best left between doctor patient transmedtwitt transright happytransitionday mede medtwitt,0.9201,positive,positive
4295,2022-11-30,-122.251559,47.250141,WA,rapist mayb that abort best,-0.1779,negative,negative
4296,2022-11-30,-121.1358805,37.48521,CA,thank spend minut with couldn stop listen song groov abort paper spotifywrap,0.0772,positive,positive
4297,2022-11-30,-83.1738665,32.6782075,GA,friendli remind decent that just happen democrat that over wife with slum lord heret abort biden lacki liar raphael warnock wolf sheep cloth georgia,-0.5106,negative,negative
4298,2022-11-30,-87.732013,41.8335845,IL,suprem court justic clarenc thoma said landmark high court rule that establish right contracept right should reconsid that feder right abort been revok thoma wrote that those rule were demonstr erron decis,0.0772,positive,positive
4299,2022-11-30,-73.320828,40.881215,NY,truli concern stat women especi black women with abort increasingli outlaw number state like thi trend increas shudder think,0.4215,positive,positive
4300,2022-11-30,-100.0768885,31.1688935,TX,petal narvaez except dollar go plan parenthood until exempt from pay tax help fund abort clinic safe contracept birth control morn after pill need address there mani unplan pregnanc,0.6808,positive,positive
4301,2022-11-30,-93.2620465,44.9706105,MN,indiana prosecutor seek punish doctor year abort case,-0.5267,negative,negative
4302,2022-11-30,-115.038337,36.006256,NV,legal thing abort riot more authoritarian allow peopl more thing than conserv would more authoritarian get feder govern enforc more authoritarian lobbi free insulin pharma,0.3903,positive,positive
4303,2022-11-30,-80.2333285,25.7823535,FL,defeat freeli choos reject doesn need need triumphant one defeat satan want thi through abort murder steal hatr lie,-0.9169,negative,negative
4304,2022-11-30,-90.5812485,38.651687,MO,your first point true sever state includ allow abort birth health reason just save life mother thi could includ thing like mental health discret doctor,0.8555,positive,positive
4305,2022-11-30,-73.9685415,40.780709,NY,dummi regist democrat concern about rise crime support abort right lgbtq right been critic trump just progress crime denial hide crimin past crimin justic system taught empathi that lack,-0.765,negative,negative
4306,2022-11-30,-83.1738665,32.6782075,GA,religi fanat destroy world trade center also crusad intifada inquisit jihad isi qaeda abort clinic bomb sayyif hama hezbollah armi robertson overturn wade yeah religion suck,-0.8126,negative,negative
4307,2022-11-30,-82.7410435,39.8902325,OH,senat presid back plan make harder amend ohio constitut secretari state frank laros unveil resolut thi month that would requir voter enact citizen initi amend such abort redistrict,0.0,neutral,positive
4308,2022-11-30,-83.804475,27.698682,FL,bergan again between initi rule point time when overturn which state abort illeg,0.0,neutral,neutral
4309,2022-11-30,-89.5694915,44.900818,WI,abort futur democraci ballot april candid seem nice they aren with most fundament issu free function societi they actual that nice,0.8467,positive,positive
4310,2022-11-30,-98.319925,38.498196,KS,state effect abort view video,0.0,neutral,neutral
4311,2022-11-30,-77.0143985,38.898603,DC,patrick cardin oboyl been dead sinc said same thing about abort ravag black commun johnpaul said that abort holocaust thi noth unusu,-0.6486,negative,negative
4312,2022-11-30,-71.4218325,41.817084,RI,seem like judg overse abort relig made some religi place guilt trip befor deni anyway,0.1027,positive,positive
4313,2022-11-30,-84.200366,39.780358,OH,today episod daysofourl good scene between vaughan put blame decis have abort chef kiss love that that tramp get what deserv,0.8176,positive,positive
4314,2022-11-30,-122.630908,45.536402,OR,witch like abort right,0.0,neutral,positive
4315,2022-11-30,-117.104989,32.810012,CA,while there pearl clutch go just more that thi poor have chanc pregnanc earli texa their draconian abort law pass last year person exist that,-0.5209,negative,negative
4316,2022-11-30,-83.804475,27.698682,FL,bergan after rule time that overturn which state abort illeg,0.0,neutral,neutral
4317,2022-11-30,-77.2038845,38.9374855,VA,outrag polit stunt oppos abort,0.0,neutral,neutral
4318,2022-11-30,-97.9351915,29.8956065,TX,done ydsa member have work hard thi semest from organ around abort right build labor campaign celebr with semest socialist winter social,-0.1027,negative,negative
4319,2022-11-30,-80.1875415,27.215948,FL,lifepetit petit cultur life,0.0,neutral,neutral
4320,2022-11-30,-84.433106,33.7671945,GA,abort would legal worldwid,0.128,positive,positive
4321,2022-11-30,-85.425011,31.232221,AL,your against abort fine with homosexu your faith joke continu allow cathol that push abort receiv forgiv your polit hack,0.7717,positive,positive
4322,2022-11-30,-72.757385,41.500753,CT,they alway take abort option support caus,0.4019,positive,positive
4323,2022-11-30,-115.223125,36.232915,NV,indiana offici seek penalti doctor spoke ohio year abort,0.0,neutral,neutral
4324,2022-11-30,-84.2306505,33.5268825,GA,support republican then hate america indiana offici seek penalti doctor spoke ohio year abort,-0.25,negative,negative
4325,2022-11-30,-80.7318815,28.313804,FL,when overturn woman right have abort understand that dobb kick down state regul would handl ban abort outright,-0.5574,negative,negative
4326,2022-11-30,-82.672903,27.7957195,FL,indiana offici seek penalti doctor spoke ohio year abort that account spark nation polit uproar week after suprem court overturn wade june,0.2263,positive,neutral
4327,2022-11-30,-87.6877965,44.095598,WI,abort murder,-0.6908,negative,negative
4328,2022-11-30,-92.131274,34.7519365,AR,teen pregnanc abort judg,0.0,neutral,neutral
4329,2022-11-30,-81.633705,38.347486,WV,,0.0,neutral,neutral
4330,2022-11-30,-85.6945125,38.440843,IN,over million babi have been kill abort sinc,-0.6908,negative,negative
4331,2022-11-30,-85.569871,42.1979655,MI,should forc murder babi better should have abort abortionismurd,-0.4215,negative,negative
4332,2022-11-30,-106.632718,35.1170025,NM,fact that babi kill texa abort babi from mexico dispos biohazard wast texa compani like oncor biocycl must remedi texa legislatur state tara shaver abort free mexico,0.0258,positive,positive
4333,2022-11-30,-86.797019,41.671926,IN,abort,0.0,neutral,neutral
4334,2022-11-30,-80.2333285,25.7823535,FL,anytim abort fetu womb,0.0,neutral,neutral
4335,2022-11-30,-122.8718135,45.491334,OR,stay away from peopl like that,0.3612,positive,positive
4336,2022-11-30,-86.1429225,39.7795625,IN,against abort vasectomi,0.0,neutral,neutral
4337,2022-11-30,-73.9685415,40.780709,NY,indianapoli indiana attorney gener ask medic board penal doctor spoke about abort year ohio rape victim,-0.7783,negative,negative
4338,2022-11-30,-71.4077465,42.078873,MA,eric broken over news that jada abort day,-0.4767,negative,neutral
4339,2022-11-30,-86.441236,39.7665555,IN,think abort should legal,0.128,positive,positive
4340,2022-11-30,-98.319925,38.498196,KS,kansa lawyer work thi area onc explain that they these case front certain judg they know will approv abort sure that work year forc teenag girl give birth twin sick,0.0258,positive,positive
4341,2022-11-30,-111.8998045,40.706168,UT,racial segreg crimin homosexu legal abort there recent suprem court case that address these learn american histori studi black histori,0.128,positive,positive
4342,2022-11-30,-71.4077465,42.078873,MA,jada tell eric abort day,0.0,neutral,neutral
4343,2022-11-30,-83.1738665,32.6782075,GA,jacobi much differ than late term abort except mother kill child choic decis rather than mother choos onli their life,-0.6908,negative,negative
4344,2022-11-30,-82.019612,41.3824635,OH,just keep do that announc nation abort ahead elect that shake cruz talk hershel after declar that racist becaus here black back lost disenfranchis black youth,-0.7906,negative,negative
4345,2022-11-30,-122.8718135,45.491334,OR,texa govt establish bounti system hunt cash abort seeker provid away moral polic christian right gain author,0.5267,positive,positive
4346,2022-11-30,-106.026119,34.166235,MN,republican underestim unifi plan deal with abort linsey graham scare away mani young women with ban abort climat chang denial lose lose ticket especi young person want futur,-0.8979,negative,negative
4347,2022-11-30,-117.462698,34.1081605,CA,inconceiv that govern dictat kill marri life come through marriag death come through abort same union there marriag among homosexu that wrong,-0.9136,negative,negative
4348,2022-11-30,-95.4464865,29.838495,TX,right might agre with that especi abort without restrict rest particularli controversi they understand openli discuss among adult they call censorship your view differ,0.2924,positive,positive
4349,2022-11-30,-100.0768885,31.1688935,TX,abort prolif,0.0,neutral,neutral
4350,2022-11-30,-77.101999,38.8808445,VA,thi incred disingenu fire invad safe space women scare from dobb decis harass them support abort thi from account disput,-0.4939,negative,positive
4351,2022-11-30,-117.294096,34.134925,CA,stop lie act like abort onli option adopt awesom stop tri justifi murder,-0.7096,negative,negative
4352,2022-11-30,-112.1246765,33.5528625,AZ,woman abl abort without father consent then should abl child doesn want have,-0.0941,negative,negative
4353,2022-11-30,-86.2447285,32.364145,AL,that there will armi lifer will come around support provid everyth from diaper child care medic care well there such realiti stori start around,0.8807,positive,positive
4354,2022-11-30,-79.420865,38.0033755,VA,shouldn suprem court overturn obergerfel where constitut doe give feder govt author defin marriag like abort should state decis,0.3612,positive,positive
4355,2022-11-30,-86.2447285,32.364145,AL,listen daili podcast dobb leak stop think about thi stori share former anti abort activist montgomeri arrest protest activ becaus jail overpopul,-0.7964,negative,negative
4356,2022-11-30,-92.4367735,38.3045585,MS,they more concern with sign bill keep marriag right than they with abort right thi countri fuck,-0.5423,negative,negative
4357,2022-11-30,-78.837021,35.7561885,NC,teen abort advoc olivia julianna just get start,0.0,neutral,neutral
4358,2022-11-30,-81.5665045,41.514008,OH,abort murder,-0.6908,negative,negative
4359,2022-11-30,-81.024144,24.732762,FL,that true onli there onli they race against self respect republican go vote good reason look parti anyth good speak thing dem most proud abort,0.9336,positive,positive
4360,2022-11-30,-77.101999,38.8808445,VA,nation lockdown decreas abort,0.0,neutral,neutral
4361,2022-11-30,-77.0143985,38.898603,DC,,0.0,neutral,neutral
4362,2022-11-30,-74.7243235,40.0730405,NJ,walker paid abort good thee,0.4404,positive,positive
4363,2022-11-30,-89.9197415,29.9280555,LA,chic know where been these disgust thing support late term abort they have been over news say better wake becaus your parti push that shit them wack job wait kill their babi disgust,-0.886,negative,negative
4364,2022-11-30,-87.998353,42.9373885,WI,what about abort,0.0,neutral,neutral
4365,2022-11-30,-80.7092255,35.1272405,NC,what about women right have child abort activist have never seen abort women right much less sanctiti life abort alway been will about control daniel philosophi modern sanger,0.0,neutral,neutral
4366,2022-11-30,-77.582242,37.654451,VA,funni abort law most access along with china north korea play pick part bibl back your argument think murder children,-0.7003,negative,negative
4367,2022-11-30,-95.767395,29.532056,TX,howev support world order kingpin that upset american compli they made argument like abort lgbt huge issu make weak believ they protect your right becaus they such emot issu while behind your back they after more,0.2732,positive,positive
4368,2022-11-30,-73.754737,41.0262045,NY,pono ultrasound until along pregnanc that point allow abort until week befor fetu viabil scienc thank make point,0.5267,positive,positive
4369,2022-11-30,-100.0768885,31.1688935,TX,what abort surpris poor child never go have father what shame,-0.7351,negative,negative
4370,2022-11-30,-74.946407,40.102243,PA,never need abort were rape pregnant absolut would right forc woman have offspr,-0.6908,negative,negative
4371,2022-11-30,-98.5406515,29.417501,TX,abort unprincipl goe against natur goe against evolut evolv biolog develop,0.0,neutral,neutral
4372,2022-11-30,-111.0518615,32.1337275,AZ,condom sinc took away right abort they should give free over counter after pill nwpc,0.5106,positive,positive
4373,2022-11-30,-122.8718135,45.491334,OR,they have abort hunter work bounti,0.0,neutral,neutral
4374,2022-11-30,-92.0611765,30.206079,LA,week full term still abort trimest certain amount week after that physician allow life mother viabil fetu that call limit,0.4588,positive,positive
4375,2022-11-30,-121.4054515,38.4897425,CA,that problem with scriptur there singl author correctli interpret interpret gibberish withstand mean anyth from feed hungri cloth poor bomb abort clinic fli plane into build,-0.8402,negative,negative
4376,2022-11-30,-81.1096165,32.0172845,GA,mechan that jesu christian jesu use name vain support right choos mean would have abort simpli mean that other decid what right them,-0.0258,negative,positive
4377,2022-11-30,-86.611411,34.7060265,AL,,0.0,neutral,neutral
4378,2022-11-30,-79.861034,35.1704985,NC,right given defin thi foundat argument declar independ constitut ratifi state they maintain jurisdict surrend central author neither marriag abort surrend,-0.3612,negative,negative
4379,2022-11-30,-92.0611765,30.206079,LA,there state with limit abort right wing,0.0,neutral,neutral
4380,2022-11-30,-96.961483,32.863917,TX,often late help conclud that atheist other lack sanctifi grace quit under dominion devil abort their sacrament rarer find intellect that darken bias favor depopul without grace,0.7096,positive,positive
4381,2022-11-30,-92.0611765,30.206079,LA,viabil fetu just walk into abort clinic late term abort even under,0.0,neutral,neutral
4382,2022-11-30,-92.0611765,30.206079,LA,less extrem posit abort mean like except rape incest mean like say that want state have right then when overturn push nationwid equiti like continu vote down effort women same,0.2732,positive,positive
4383,2022-11-30,-117.789005,33.8904245,CA,onli republican legisl vote grotesqu abort your child abort until birth prop ballot lost,-0.3182,negative,negative
4384,2022-11-30,-91.4010085,30.937336,LA,neagu here anoth articl republican birth control,0.0,neutral,neutral
4385,2022-11-30,-75.66877,41.4194095,PA,more abort,0.0,neutral,neutral
