,date,Longitude,Latitude,State,tweet_clean,sentiment,sentiment_category,y_predict
1476,2022-11-13,-80.926628,33.6311395,SC,yahoo entertain billi eilish urg fan vote midterm right freedom futur line,0.8316,positive,positive
1477,2022-11-13,-96.053431,41.275721,NE,state befor that caus women death agre have constitut right save your life therefor abort ban should unconstitut,-0.6486,negative,negative
1478,2022-11-13,-85.45756,38.313243,KY,almost like fund medicar social secur public school popular crimin abort bulli tran kid ban book aren,0.1045,positive,positive
1479,2022-11-13,-117.3630675,34.531222,CA,terrenc your wrong senat under rule would bring vote feder abort just sweet graham,-0.0258,negative,negative
1480,2022-11-13,-73.9685415,40.780709,NY,republican need accept fact that although mani disagre abort thi women must decid themselv they want continu pregnanc thi they lost mani elect they should have,0.1531,positive,positive
1481,2022-11-13,-77.2899545,38.567849,VA,alway have agre understand where come from sometim that have more common with each other than what differ like abort woman choic make that decis right will defend,0.3612,positive,positive
1482,2022-11-13,-104.897597,39.587731,CO,abort chang time,0.0,neutral,neutral
1483,2022-11-13,-122.3306025,47.614817,WA,racist like want abort illeg while pay abort complet hypocrit,-0.3818,negative,negative
1484,2022-11-13,-73.117467,40.8591315,NY,rememb them clap happi that abort pass disgrac,0.0,neutral,neutral
1485,2022-11-13,-87.732013,41.8335845,IL,well concept begin tripartit life obvious true fetu doe possess then abort murder fetu person potenti person million spontan abort everi year prove that,-0.2023,negative,negative
1486,2022-11-13,-75.117998,40.0048655,PA,doubt mani devout evangel cathol constitu will permit parti moder hard core antiabort stanc ever sinc wade court these element them dictat reproduct polici conceiv moder abort polici,-0.4404,negative,negative
1487,2022-11-13,-86.2705395,45.00118,MI,abort healthcar,0.0,neutral,neutral
1488,2022-11-13,-85.45756,38.313243,KY,should make provid reproduct care includ abort prioriti everywher empow mother everyon with power decid mani children they respons doe wonder their econom potenti holist well be,0.6486,positive,positive
1489,2022-11-13,-117.2879235,33.121484,CA,about send them back home with their famili parent where they want anyway much better narciss that prevent from do what best them,0.8176,positive,positive
1490,2022-11-13,-106.632718,35.1170025,NM,democrat thi think went need focu kitchen tabl issu one that would affect voter daili live know what also kitchen tabl issu abort want someon kitchen tabl becaus illeg perform procedur,0.0772,positive,positive
1491,2022-11-13,-106.632718,35.1170025,NM,from washington post liber women rage twofold there rage initi dobb decis then rage listen pundit admonish that democrat shouldn make midterm about abort access midterm roevemb,-0.8957,negative,negative
1492,2022-11-13,-81.8030515,41.4804175,OH,abort right should state level issu individu state still vote whether slaveri concept state right obsolet,0.0,neutral,neutral
1493,2022-11-13,-73.9685415,40.780709,NY,becaus fascism better ban book bash gay fact that they tri abort nation help them midterm,0.25,positive,positive
1494,2022-11-13,-87.848561,42.711776,WI,that great cours cours someon your famili want abort your tell other peopl what with their health,0.6597,positive,positive
1495,2022-11-13,-96.053431,41.275721,NE,enough caus women carri dead babi week some have die becaus they were deni abort,-0.8481,negative,negative
1496,2022-11-13,-93.400136,44.927631,MN,yourself fool into believ voter privileg there data show opposit that they should written into cultur fight abort lgbtqia racism amend into vote just told that,-0.8625,negative,negative
1497,2022-11-13,-81.57605,30.7677845,GA,tragic abort should birth control,-0.4588,negative,neutral
1498,2022-11-13,-96.053431,41.275721,NE,right find total abort that pass lie wouldn lie know search which abort bill have been introduc state short period time howev law that have been pass clear,0.3818,positive,positive
1499,2022-11-13,-95.913642,36.1093915,OK,walter parti need grip suck gain seat abort base exit poll reason rep didn better rep still took hous which goal still extrem well state legislatur,0.6705,positive,positive
1500,2022-11-13,-79.420865,38.0033755,VA,could captur fade much tri apart sourc gain replet anim insect minu variabl they wert again often see jesu cindi femal back then long abort math more more than els everytim,0.5267,positive,positive
1501,2022-11-13,-118.4119065,34.0207895,CA,found father meant feder govern have veri littl power most govern done state level let back that henc overturn which about abort about get decid abort state feder govt,0.0,neutral,neutral
1502,2022-11-13,-82.985772,39.9946835,OH,exactli over read comment like abort main culprit here,0.3612,positive,positive
1503,2022-11-13,-80.2333285,25.7823535,FL,democrat hold onto their hous singl seat senat major after elect where abort obvious major factor will singl congression republican join democrat vote codifi wade into,0.296,positive,positive
1504,2022-11-13,-77.406826,38.9347395,VA,major women come here illeg wouldn dare think about abort option howev applaud left tri american these illeg immigr through their uteru obamaphoneandabortionswag,0.4588,positive,positive
1505,2022-11-13,-105.5508905,38.997936,CO,scotu wait till week after just after like student loan judgement wouldn have such elect impact think mani that want protect abort till birth felt high inflat altern,0.6597,positive,positive
1506,2022-11-13,-96.053431,41.275721,NE,think have differ opinion what abort what your definit abort,0.0,neutral,neutral
1507,2022-11-13,-93.3613205,46.4418605,MN,what joke about abort overli sensit actual illeg what they protest intimid justic sole purpos them chang their decis abort illeg should,0.0516,positive,negative
1508,2022-11-13,-98.5406515,29.417501,TX,abort matter privaci,0.0258,positive,positive
1509,2022-11-13,-74.946407,40.102243,PA,elli know anyon tell differ between maga maga lump togeth local larger shapiro case where mani ind associ maga encompass they vote shapiro abort,0.0,neutral,neutral
1510,2022-11-13,-79.861034,35.1704985,NC,thi doe includ everyon univers standard call just like abort homosexu unbelief,0.3612,positive,positive
1511,2022-11-13,-98.5406515,29.417501,TX,sound like want impregn closet queen least wouldn have worri about abort payment,0.4215,positive,positive
1512,2022-11-13,-75.770041,42.746617,NY,anyth till after midterm becaus cours floriduh rondefacist womensrightsarehumanright,0.0,neutral,neutral
1513,2022-11-13,-84.37803,33.902927,GA,broke abort mission suprem court justic coney barrett speak federalist societi crack joke about abort right,-0.1531,negative,negative
1514,2022-11-13,-84.2306505,33.5268825,GA,true traitor democraci coney barrett crack joke about abort right protest with federalist societi,0.4588,positive,positive
1515,2022-11-13,-80.087032,42.110703,PA,thi just they tri with abort polici,0.0,neutral,neutral
1516,2022-11-13,-93.6039505,44.81615,MN,burton need understand that they have problem abort rule trump real republican aren trump support,0.0,neutral,negative
1517,2022-11-13,-82.563903,41.3935095,OH,dub specul about mental acuiti issu that should preclud take potshot decid minor take joke abort joke fail your analog minor obvious noth with abort issu,-0.0258,negative,negative
1518,2022-11-14,-119.025163,35.3469015,CA,imagin advoc focus end abort demand,-0.128,negative,negative
1519,2022-11-14,-111.88024,40.688518,UT,then couldn have taken beth that sketchi abort render steril,0.0,neutral,neutral
1520,2022-11-14,-106.7533895,34.807745,NM,could posit take away abort right threaten birth control access end marriag crimin peopl ignor mass shoot promis social secur medicar elect,-0.6124,negative,negative
1521,2022-11-14,-117.5800355,33.9793435,CA,ridicul wick peopl babi womb clump piec tissu human be call abort merci human be creat imag abort murder eye merci,-0.6908,negative,negative
1522,2022-11-14,-81.7110335,38.3399245,WV,partial birth abort done case dire emerg regard mother infant support thi fulli becaus monster,-0.0772,negative,positive
1523,2022-11-14,-83.1738665,32.6782075,GA,then abort right,0.0,neutral,neutral
1524,2022-11-14,-93.1056485,44.9415155,MN,they that they even care about polit cost becaus such schmittian high truth that onli tini minor want abort illeg tinier care that their state right make that case feder,0.8402,positive,positive
1525,2022-11-14,-93.1056485,44.9415155,MN,will need republican both enough abort thi though,0.0,neutral,neutral
1526,2022-11-14,-83.1738665,32.6782075,GA,everi singl consult told candid ignor issu rather than point that democrat month abort should fire that foolish decis,-0.5423,negative,neutral
1527,2022-11-14,-116.399697,43.6120725,ID,gigo vast major women when ask reason they were get abort told interview fuck equival answer given side say them were elect which bullshit there quantifi answer thi question,-0.836,negative,negative
1528,2022-11-14,-73.9685415,40.780709,NY,abort funder herschel walker,0.0,neutral,neutral
1529,2022-11-14,-112.3221785,33.6053915,AZ,prefer live countri that women have access right abort want save unborn child then must women have been rape doesn deserv strip their right wether keep child pregnanc fruit love violenc,0.4588,positive,positive
1530,2022-11-14,-117.874032,33.617638,CA,sean understand women vote against abort year vote think colleg tuition were gonna paid which blatant after elect judg came down ban aren make bigger deal that,-0.5574,negative,negative
1531,2022-11-14,-77.0143985,38.898603,DC,these peopl hilari befor they talk about abort wouldn matter they talk about import abort,0.0258,positive,positive
1532,2022-11-14,-83.804475,27.698682,FL,tedrow must disappoint kill those children abort after birth that,-0.8126,negative,negative
1533,2022-11-14,-70.8580915,42.5662945,MA,abort right,0.0,neutral,neutral
1534,2022-11-14,-72.4511725,43.8717565,VT,dem well becaus abort elect denier which cost moder independ those thing made look extrem,-0.1027,negative,negative
1535,2022-11-14,-117.643819,33.5513865,CA,more brain cell there hate your posit abort hate your posit social secur lost independ more particip could adopt polici major hate keep tri kill democraci,-0.9527,negative,negative
1536,2022-11-14,-77.0143985,38.898603,DC,mitt romney just call trump age pitcher mound say abort bigger issu than republican anticip think presid trump albatross,0.0,neutral,neutral
1537,2022-11-14,-87.848561,42.711776,WI,have proof that democrat want codiifi partial birth abort,0.0772,positive,positive
1538,2022-11-14,-119.7824645,36.786042,CA,that hard decid toss between ban assault weapon make sure abort legal nation wide expand suprem court even thought make puerto rico state just make sure that senat hous stay blue,-0.5574,negative,negative
1539,2022-11-14,-95.4464865,29.838495,TX,parti that scream about ban abort forc victim rape have that babi will turn around month attack victim welfar queen cheat lazi irrespons have babi when obvious couldn afford,-0.9652,negative,negative
1540,2022-11-14,-85.905326,32.5487265,AL,death after force have abort still aliv pregnant laugh like exorcist know well just felt right side nose drain salt water center abov lippiyhiszxxzz thi probabl wetumpka hurt,-0.0258,negative,negative
1541,2022-11-14,-84.5030665,34.110776,GA,compromis abort,0.0,neutral,neutral
1542,2022-11-14,-110.9155735,32.1893905,AZ,know plan parenthood reason other then abort right,0.0,neutral,neutral
1543,2022-11-14,-122.3306025,47.614817,WA,wing there anybodi they live word support abort claim reverend must church satan same church clinton attend,0.4019,positive,positive
1544,2022-11-14,-112.35157,33.4969085,AZ,note that thi hasn been stanc long time anti abort anti maid when choic understand seem that prior birth fetu potenti human human,-0.5574,negative,negative
1545,2022-11-14,-122.4359785,37.7706565,CA,that over time women will forget about be deni access abort,-0.2263,negative,negative
1546,2022-11-14,-122.3306025,47.614817,WA,legal induc abort were report from report area onli regurgit same talk point democrat vomit right dismemb unborn children women want abort women want safe from rape incest,-0.1779,negative,negative
1547,2022-11-14,-97.754724,30.3233455,TX,democrat need state that referendum power start effort abort their constitut elect,0.0,neutral,neutral
1548,2022-11-14,-81.705467,41.4959395,OH,real make abort illeg abort will onli limit safe abort which amount poor again clue,-0.0516,negative,negative
1549,2022-11-14,-116.399697,43.6120725,ID,posit abort here zero toler rape incest death mother includ prosecut suspect induc miscarriag there also support here parent right rapist believ what will blind support suspect,-0.9451,negative,negative
1550,2022-11-14,-80.1129035,26.533486,FL,women haven lost anyth abort still legal,-0.2023,negative,negative
1551,2022-11-14,-81.068556,29.190223,FL,rememb they tell abort,0.0,neutral,neutral
1552,2022-11-14,-122.4359785,37.7706565,CA,glad know governor virginia lifetim member pray univers virginia prioriti restrict tran right critic race theori abort done noth address violenc,0.1531,positive,negative
1553,2022-11-14,-80.8467855,35.209059,NC,doesn thi compromis just give same marriag same statu abort sure legal long afford travel right state,0.4215,positive,positive
1554,2022-11-14,-77.604684,41.1179365,PA,democrat guarante that will protect woman right have abort will never social secur medicar ever rais tax then have vote intellig smart also decent human be good luck,0.8807,positive,positive
1555,2022-11-14,-80.0280425,40.5838765,PA,bunch factor abort control women right gener climat chang,0.0,neutral,neutral
1556,2022-11-14,-111.7385665,33.295215,AZ,help commun get marri befor have children that collater upsid anoth abort,0.4019,positive,positive
1557,2022-11-14,-81.0094105,29.167045,FL,pass legisl protect vote codifi abort right,0.3818,positive,positive
1558,2022-11-14,-83.1738665,32.6782075,GA,they still want believ care about abort control they ignor vote result,0.5423,positive,positive
1559,2022-11-14,-73.9487755,40.655138,NY,right which exactli what origin post say support abort support abort,0.6597,positive,positive
1560,2022-11-14,-71.683502,42.036939,MA,vote herschel anti abort that own abort clinic entir plaza abort politician herschel walker georgia healey,-0.3182,negative,negative
1561,2022-11-14,-85.7682405,37.822244,KY,from decid murder someon they just clump cell abort legal babi legal human outsid womb thi societi jade make sens anyon read thi would outrag offend idea,-0.7096,negative,negative
1562,2022-11-14,-77.6543395,39.9340275,PA,abort homocid should treat such regardless malici opinion abort democrat when someon goe kill anyon cold blood murder differ when mother kill unborn babi veri demon holocaust,-0.9246,negative,negative
1563,2022-11-14,-77.8670185,34.173113,NC,dude abort know more than think,0.0,neutral,neutral
1564,2022-11-14,-119.827182,39.512436,NV,half believ abort murder other half doe,-0.6908,negative,negative
1565,2022-11-14,-76.969264,38.796432,MD,which person suggest vote wife beater russian roulett player abort payer daddi abandon herschel walker reveal suffer from multipl person disord,-0.7506,negative,negative
1566,2022-11-14,-95.538134,30.337514,TX,that problem with see issu abort black white gener doesn cover everyon everi situat differ everyon differ experi problem,-0.6597,negative,negative
1567,2022-11-14,-117.849687,34.1355205,CA,think feel much unlik that rais mass shoot rais scream peopl outsid abort clinic famou fiction sherif onc said start when stop hear sir,-0.743,negative,negative
1568,2022-11-14,-94.37759,44.883311,MN,congress week period guess what then back feder court state right about abort,0.0,neutral,neutral
1569,2022-11-14,-118.006657,33.8527355,CA,beamer pimp hand calhoun howev scotu they be consist will block feder legisl regard abort either they have rule state matter will grant that they consist,0.4404,positive,positive
1570,2022-11-14,-83.804475,27.698682,FL,assault weapon initi total abort ban revamp elect process person ever claim stolen make univers take deduct absorb cost student loan forgiv make elect feder holiday,-0.8779,negative,negative
1571,2022-11-14,-90.702644,38.7796565,MO,that those percentag there sever unbias media outlet that state fact associ press wall street journal reuter span christian scienc monitor research economist googl scholar kept fact especi abort,0.0,neutral,neutral
1572,2022-11-14,-97.754724,30.3233455,TX,damn sure that ban abort lord work,-0.6124,negative,negative
1573,2022-11-14,-79.861034,35.1704985,NC,state suprem court win shape abort redistrict,0.5859,positive,positive
1574,2022-11-14,-74.0070295,40.3590065,NJ,prioriti press cultur button like tran restrict anti abort law seriou candid nomin presid control glenn prioriti thought prayer meaningless,-0.6486,negative,negative
1575,2022-11-14,-71.4356815,42.305097,MA,issu peopl vote accordingli howev veri close issu abort which peopl vote democrat attent,0.0,neutral,neutral
1576,2022-11-14,-117.802135,33.7337835,CA,control abort right prosecut trump,0.0,neutral,neutral
1577,2022-11-14,-112.021045,46.597517,MT,brock jackson weimer,0.0,neutral,neutral
1578,2022-11-14,-86.6807375,32.576227,AL,thi weirdest touch convers between abort until birth those agreement about southern white women they stay home mom uneduc life reason mayb thi feed mile apart real clue,0.3182,positive,positive
1579,2022-11-14,-80.926628,33.6311395,SC,that abort without sound babi said cut vocal chord,-0.2732,negative,negative
1580,2022-11-14,-86.6807375,32.576227,AL,stay home mom right wing religi sunday church goer thi elect some state made choic that meant pick your poison didn vote becaus anti abort vote econom period,-0.7003,negative,negative
1581,2022-11-14,-84.2606725,33.7528875,GA,weird that some peopl femin issu with romant life oppos public polici issu like equal sexual harass abort law,-0.34,negative,positive
1582,2022-11-14,-158.0114715,21.446277,HI,knew unmarri woman other after other parti life abort fight onli take half fight doe much take fight take whole fight,-0.8555,negative,negative
1583,2022-11-14,-82.506284,28.0170115,FL,seem that more peopl were interest abort than safeti well be countri,0.6557,positive,neutral
1584,2022-11-14,-82.506284,28.0170115,FL,thought guess more peopl were more interest abort then save countri,0.7574,positive,positive
1585,2022-11-14,-116.399697,43.6120725,ID,anoth rape individu here that believ death mother befor abort serious grasp that concept consensu insist doubl down theft person autonomi just onc twice anyway,-0.872,negative,negative
1586,2022-11-14,-112.021045,46.597517,MT,child die everi abort that botch,-0.5994,negative,negative
1587,2022-11-14,-108.193367,36.75742,NM,nmleg dem will seek codifi abortionright next session with bill base exec order that state abort essenti part reproductivehealth care must remain legal safe access,0.765,positive,positive
1588,2022-11-14,-94.4607525,44.312395,MN,conserv want abort marriag,0.0772,positive,positive
1589,2022-11-14,-77.604684,41.1179365,PA,win democrat chamber governorship doesn guarante right abort thi onli step codifi everi state codifi congress then celebr,0.5859,positive,positive
1590,2022-11-14,-80.087032,42.110703,PA,mail didn guy look excus instead tri figur problem abort then trump anyth,-0.4019,negative,negative
1591,2022-11-14,-80.087032,42.110703,PA,know bunch republican vote abort trump that just circl,0.0,neutral,neutral
1592,2022-11-14,-120.987468,37.663817,CA,democrat group pac spent ten million least state elev republican hold extrem posit abort right support conspiraci theori that trump elect,0.4019,positive,positive
1593,2022-11-14,-96.2916485,30.5854715,TX,wave trickl would never pass anyth senat mook even pass abort nationwid with democrat still control senat,0.0,neutral,neutral
1594,2022-11-14,-110.9155735,32.1893905,AZ,fwiw reason wave young voter lean democrat elect denier animos trump weak candid abort ballot screw mcconnel coordin between social media censor republican,-0.8316,negative,negative
1595,2022-11-14,-120.882482,47.273022,WA,abort right never right judg suprem court were compromis should been never rule,0.0,neutral,neutral
1596,2022-11-14,-93.3613205,46.4418605,MN,state moder their abort law they will becom perman nation minor chanc republican potu will zero,0.0,neutral,neutral
1597,2022-11-14,-95.913642,36.1093915,OK,suck becaus lake will have wait arizona peopl one will suffer exit poll show abort huge economi crime will dem back defund polic thing onli go wors pain just begin,-0.8979,negative,negative
1598,2022-11-14,-122.4331955,45.5101405,OR,lmao these result clearli abort delusion magat,0.5994,positive,neutral
1599,2022-11-14,-87.6877965,44.095598,WI,abort solv noth onli increas pain trauma,-0.7269,negative,neutral
1600,2022-11-14,-117.104989,32.810012,CA,premium abort reproduct servic domain avail acquisit brand organ search traffic have increas dramat choic healthcar womensright planb,0.0,neutral,neutral
1601,2022-11-14,-83.612056,42.508453,MI,vladeck more more state enshrin abort other right state constitut there preced scotu invalid state constitut provis base concept natur right loos feder constitut principl,0.0,neutral,neutral
1602,2022-11-14,-88.1425115,41.519556,IL,what doe thi have with critic race theori abort,-0.2732,negative,negative
1603,2022-11-14,-115.3353435,36.120959,NV,that also becaus abort ballot indiana outlaw ballot initi supermajor will never permit becaus they know they lose dem need target genz registr gotv,-0.4019,negative,negative
1604,2022-11-14,-95.4464865,29.838495,TX,remind that abort stage pregnanc illeg texa juli like,0.3612,positive,positive
1605,2022-11-14,-87.946235,42.170104,IL,republican want control women bodi keep tell lie about abort abort babi that healthi daughter babi week becaus danger babi prematur fine kill healthi babi call murder,-0.9136,negative,negative
1606,2022-11-14,-73.9487755,40.655138,NY,they exist their claim that they support abort complet fals when they think shouldn allow under certain circumst dictat them those peopl support abort just becaus they think should sometim allow,0.8519,positive,positive
1607,2022-11-14,-88.0088995,42.9592855,WI,polit afraid state vote control women reproduct need like abort go take back presid vote head reason colleg student other crossov conserv will keep vote,0.3612,positive,positive
1608,2022-11-14,-89.876449,32.571032,MS,student loan paid democrat vote they lie about abort vote democrat voter they lie again hope enjoy inflat high price open boarder enjoy suck thi,0.7506,positive,positive
1609,2022-11-14,-73.860857,40.9445675,NY,glad they trump pick loser candid campaign them with them democrat have have anyway will peopl vote right abort against privat social secur medicaid continu prosecut donald,-0.1027,negative,positive
1610,2022-11-14,-82.8080405,39.8381705,OH,they think much their women they would love know women that abort last year were actual republican more than they would like admit,0.8176,positive,positive
1611,2022-11-14,-104.99719,39.647635,CO,keep tri justifi anita abort law refus truth about thi whole thing that,0.3182,positive,positive
1612,2022-11-14,-104.99719,39.647635,CO,everi situat differ most women have abort well after trimest usual want their fetu there medic issu where abort onli option becaus that procedur live women extra risk,0.0772,positive,positive
1613,2022-11-14,-104.99719,39.647635,CO,that wasn your origin assert said ectop pregnanc same abort simpli state that same becaus procedur remov fetu exactli same just move goalpost wrong wrong both,-0.7351,negative,negative
1614,2022-11-14,-71.5507035,42.3458205,MA,gman worri more about genitalia bitch complain about tran women women locker room get weird boy wear nail polish report parent take their teen abort after rape,-0.918,negative,negative
1615,2022-11-14,-85.45756,38.313243,KY,access contracept healthcar reduc demand abort interest reduc abort reduc demand more effect than block access lifer that push those polici doesn care about abort they care about control,0.6412,positive,positive
1616,2022-11-14,-85.2511195,37.57046,KY,gotta born that should democrat slogan abort move forward,0.0,neutral,neutral
1617,2022-11-14,-73.4815685,41.0753625,CT,lake anti choic thi elect referendum dobb be overturn elect denier thought hobb debat mistak woman young came forc keep abort safe legal what want have choic,-0.0258,negative,negative
1618,2022-11-14,-90.3992495,38.4245325,MO,with that nation abort work think that lindsey should alway listen just what say,0.0,neutral,neutral
1619,2022-11-14,-97.536286,32.93173,TX,still abort right issu there hundr birth control method most some post your support say women smart enough think ahead know what go their bodi them that sure,0.7717,positive,positive
1620,2022-11-14,-87.732013,41.8335845,IL,right speak about racism howev america there women girl quit obviou like nose face attack wifey regular basi realli open eye befor late regret forev abort,-0.8176,negative,negative
1621,2022-11-14,-121.469664,38.561722,CA,thi some conserv california counti where anti abort candid doe abort more great content like thi subscrib sacramento here,0.7056,positive,positive
1622,2022-11-14,-85.7682405,37.822244,KY,base kentucki think vote with keep abort,0.0,neutral,neutral
1623,2022-11-14,-78.7646315,43.0091165,NY,first charli price have gone down most american will drive electr vehicl dem final address climat chang without republican obstruct women will lose there right safe abort turn well that,0.3182,positive,positive
